{
  "$schema": "https://json-schema.org/draft/2020-12/schema",
  "$id": "https://platform.local/contracts/meta-commands/1.0",
  "title": "元模型(M2)授权命令信封与载荷契约 v1.0(addendum)",
  "type": "object",
  "required": ["commandType", "workspaceId", "correlationId", "idempotencyKey", "payload"],
  "additionalProperties": false,
  "properties": {
    "commandType": {
      "enum": ["DefineObjectType", "DefineFieldDef", "DefineRelationType"]
    },
    "workspaceId": { "$ref": "#/$defs/uuid" },
    "correlationId": { "$ref": "#/$defs/uuid" },
    "idempotencyKey": { "type": "string", "minLength": 1, "maxLength": 128 },
    "payload": { "type": "object" }
  },
  "allOf": [
    { "if": { "properties": { "commandType": { "const": "DefineObjectType" } } }, "then": { "properties": { "payload": { "$ref": "#/$defs/DefineObjectType" } } } },
    { "if": { "properties": { "commandType": { "const": "DefineFieldDef" } } }, "then": { "properties": { "payload": { "$ref": "#/$defs/DefineFieldDef" } } } },
    { "if": { "properties": { "commandType": { "const": "DefineRelationType" } } }, "then": { "properties": { "payload": { "$ref": "#/$defs/DefineRelationType" } } } }
  ],
  "$defs": {
    "uuid": { "type": "string", "pattern": "^[0-9a-fA-F]{8}-[0-9a-fA-F]{4}-[0-9a-fA-F]{4}-[0-9a-fA-F]{4}-[0-9a-fA-F]{12}$" },
    "code": { "type": "string", "minLength": 1, "maxLength": 128, "pattern": "^[a-z][a-z0-9_]*$", "description": "snake_case 标识符" },
    "dataType": { "enum": ["string", "text", "integer", "number", "boolean", "date", "datetime", "enum", "ref", "json"] },
    "DefineObjectType": {
      "type": "object",
      "required": ["code", "name"],
      "additionalProperties": false,
      "properties": {
        "templateVersionId": { "$ref": "#/$defs/uuid", "description": "可空:NULL=无模板直挂(兼容 demo);非空必须指向 draft 模板版本,published 版本下定义返回 KERNEL-409-TEMPLATE-VERSION-IMMUTABLE" },
        "code": { "$ref": "#/$defs/code", "description": "(workspace, code) 唯一" },
        "name": { "type": "string", "minLength": 1, "maxLength": 256 }
      }
    },
    "DefineFieldDef": {
      "type": "object",
      "required": ["objectTypeId", "code", "name", "dataType"],
      "additionalProperties": false,
      "properties": {
        "objectTypeId": { "$ref": "#/$defs/uuid", "description": "归属对象类型,不存在返回 KERNEL-404-TYPE-NOT-FOUND" },
        "code": { "$ref": "#/$defs/code", "description": "(objectType, code) 唯一" },
        "name": { "type": "string", "minLength": 1, "maxLength": 256 },
        "dataType": { "$ref": "#/$defs/dataType" },
        "required": { "type": "boolean", "default": false },
        "constraints": {
          "type": "object",
          "additionalProperties": false,
          "description": "按 dataType 取用;不相容组合返回 KERNEL-422-FIELD-CONSTRAINT-INVALID",
          "properties": {
            "minLength": { "type": "integer", "minimum": 0 },
            "maxLength": { "type": "integer", "minimum": 1 },
            "min": { "type": "number" },
            "max": { "type": "number" },
            "pattern": { "type": "string", "maxLength": 256, "description": "白名单正则;禁灾难性回溯" },
            "enumValues": { "type": "array", "items": { "type": "string" }, "minItems": 1, "uniqueItems": true },
            "refObjectTypeCode": { "$ref": "#/$defs/code", "description": "dataType=ref 时必填,指向对象类型 code" }
          }
        }
      }
    },
    "DefineRelationType": {
      "type": "object",
      "required": ["code", "sourceTypeId", "targetTypeId", "direction", "cardinality", "semantics"],
      "additionalProperties": false,
      "properties": {
        "code": { "$ref": "#/$defs/code", "description": "(workspace, code) 唯一" },
        "name": { "type": "string", "minLength": 1, "maxLength": 256 },
        "sourceTypeId": { "$ref": "#/$defs/uuid" },
        "targetTypeId": { "$ref": "#/$defs/uuid" },
        "direction": { "enum": ["directed", "undirected"] },
        "cardinality": { "enum": ["one_to_one", "one_to_many", "many_to_many"] },
        "semantics": { "enum": ["weak", "strong"] },
        "hierarchical": { "type": "boolean", "default": false, "description": "true 必须 cardinality=one_to_many(承 V2 约束),违反返回 KERNEL-422-FIELD-CONSTRAINT-INVALID" }
      }
    }
  }
}
