{
  "commandType": "DefineObjectType",
  "workspaceId": "11111111-1111-4111-8111-111111111111",
  "correlationId": "22222222-2222-4222-8222-222222222222",
  "idempotencyKey": "define-ot-perf-req-1",
  "payload": {
    "code": "performance_requirement",
    "name": "性能需求",
    "parentTypeCode": "requirement"
  }
}
