{
  "commandType": "DefineFieldDef",
  "workspaceId": "11111111-1111-4111-8111-111111111111",
  "correlationId": "22222222-2222-4222-8222-222222222222",
  "idempotencyKey": "define-fd-budget-1",
  "payload": {
    "objectTypeId": "22222222-2222-4222-8222-222222222222",
    "code": "budget",
    "name": "预算",
    "dataType": "number",
    "required": false,
    "constraints": { "min": 0 }
  }
}
