{
  "commandType": "DefineRelationType",
  "workspaceId": "11111111-1111-4111-8111-111111111111",
  "correlationId": "22222222-2222-4222-8222-222222222222",
  "idempotencyKey": "define-relation-type-templated-1",
  "payload": {
    "code": "selects_product",
    "name": "选型",
    "sourceTypeId": "44444444-4444-4444-8444-444444444444",
    "targetTypeId": "55555555-5555-4555-8555-555555555555",
    "direction": "directed",
    "cardinality": "one_to_many",
    "semantics": "strong",
    "templateVersionId": "66666666-6666-4666-8666-666666666666"
  }
}
