{
  "commandType": "DefineRelationType",
  "workspaceId": "11111111-1111-4111-8111-111111111111",
  "correlationId": "22222222-2222-4222-8222-222222222222",
  "idempotencyKey": "define-rt-decompose-1",
  "payload": {
    "code": "decomposes_to",
    "name": "分解",
    "sourceTypeId": "22222222-2222-4222-8222-222222222222",
    "targetTypeId": "22222222-2222-4222-8222-222222222222",
    "direction": "directed",
    "cardinality": "one_to_many",
    "semantics": "strong",
    "hierarchical": true
  }
}
