{
  "commandType": "DefineFieldDef",
  "workspaceId": "11111111-1111-4111-8111-111111111111",
  "correlationId": "22222222-2222-4222-8222-222222222222",
  "idempotencyKey": "define-fd-name-redef-1",
  "payload": {
    "objectTypeId": "33333333-3333-4333-8333-333333333333",
    "code": "name",
    "name": "名称",
    "valueTypeCode": "paragraph",
    "required": true,
    "redefinesFieldCode": "name",
    "constraints": { "maxLength": 50 }
  }
}
